{
  "schemaVersion": 1,
  "catalogId": "UABC-DOCUMENT-CATALOG-V1",
  "contractId": "UABC-PROJECT-DATA-V1",
  "projectId": "UABC-BC-BASIC-001",
  "sourceIndexPath": "exports/project-data/v1/index.yaml",
  "allowedBranch": "codex/universaarl-projekt",
  "commitBinding": "allowed-branch-head-resolved-once",
  "readOnly": true,
  "validationStatus": "validated",
  "allowedExternalOrigins": [],
  "spaces": [
    {
      "spaceId": "UABC-SPACE-CUSTOMER",
      "spaceType": "customer-project",
      "title": "Universaarl Kundenprojekt",
      "purpose": "Fuehrende Wahrheit fuer die konkrete Universaarl-Kundeninstanz.",
      "audience": [
        "Kunde",
        "Projektleitung",
        "Key User",
        "Consultant"
      ],
      "order": 0,
      "homeDocumentId": "UABC-PROJECT",
      "externalUrl": null,
      "pageId": null,
      "spaceKey": null
    },
    {
      "spaceId": "UABC-SPACE-PRODUCT",
      "spaceType": "standard-product",
      "title": "BC Basic Produkt",
      "purpose": "Pilot-Arbeitsstand fuer das verkaufte und gelieferte BC-Basic-Leistungsmodell.",
      "audience": [
        "Vertrieb",
        "Projektleitung",
        "Consultant",
        "Solution Architect"
      ],
      "order": 1,
      "homeDocumentId": "UABC-BCBPROJECT",
      "externalUrl": null,
      "pageId": null,
      "spaceKey": null
    },
    {
      "spaceId": "UABC-SPACE-CONSULTANT",
      "spaceType": "consultant-internal",
      "title": "BC Basic Consulting-Handbuch",
      "purpose": "Pilot-Arbeitsstand fuer die reproduzierbare interne Durchfuehrung.",
      "audience": [
        "Consultant",
        "Solution Architect",
        "Support"
      ],
      "order": 2,
      "homeDocumentId": "UABC-BLUEPRINT",
      "externalUrl": null,
      "pageId": null,
      "spaceKey": null
    }
  ],
  "navigationModules": [
    {
      "moduleId": "UABC-NAV-CUSTOMER",
      "spaceId": "UABC-SPACE-CUSTOMER",
      "title": "Universaarl Kundenprojekt",
      "order": 0
    },
    {
      "moduleId": "UABC-NAV-PRODUCT",
      "spaceId": "UABC-SPACE-PRODUCT",
      "title": "BC Basic Produkt",
      "order": 1
    },
    {
      "moduleId": "UABC-NAV-CONSULTANT",
      "spaceId": "UABC-SPACE-CONSULTANT",
      "title": "BC Basic Consulting-Handbuch",
      "order": 2
    }
  ],
  "navigationNodes": [
    {
      "nodeId": "UABC-NAV-NODE-CUSTOMER",
      "moduleId": "UABC-NAV-CUSTOMER",
      "nodeType": "group",
      "title": "Universaarl Kundenprojekt",
      "order": 0,
      "parentNodeId": null,
      "documentId": null,
      "description": "Fuehrende Wahrheit fuer die konkrete Universaarl-Kundeninstanz.",
      "initialState": "expanded"
    },
    {
      "nodeId": "UABC-NAV-NODE-PRODUCT",
      "moduleId": "UABC-NAV-PRODUCT",
      "nodeType": "group",
      "title": "BC Basic Produkt",
      "order": 0,
      "parentNodeId": null,
      "documentId": null,
      "description": "Pilot-Arbeitsstand fuer das verkaufte und gelieferte BC-Basic-Leistungsmodell.",
      "initialState": "expanded"
    },
    {
      "nodeId": "UABC-NAV-NODE-CONSULTANT",
      "moduleId": "UABC-NAV-CONSULTANT",
      "nodeType": "group",
      "title": "BC Basic Consulting-Handbuch",
      "order": 0,
      "parentNodeId": null,
      "documentId": null,
      "description": "Pilot-Arbeitsstand fuer die reproduzierbare interne Durchfuehrung.",
      "initialState": "expanded"
    },
    {
      "nodeId": "UABC-NAV-NODE-PROJECT",
      "moduleId": "UABC-NAV-CUSTOMER",
      "nodeType": "page",
      "title": "00 Hilfe und Projektumgebung",
      "order": 0,
      "parentNodeId": "UABC-NAV-NODE-CUSTOMER",
      "documentId": "UABC-PROJECT",
      "initialState": "expanded"
    },
    {
      "nodeId": "UABC-NAV-NODE-COMPANY",
      "moduleId": "UABC-NAV-CUSTOMER",
      "nodeType": "page",
      "title": "01 Unternehmen",
      "order": 1,
      "parentNodeId": "UABC-NAV-NODE-CUSTOMER",
      "documentId": "UABC-COMPANY",
      "initialState": "expanded"
    },
    {
      "nodeId": "UABC-NAV-NODE-BCBDELIVERABLES",
      "moduleId": "UABC-NAV-CUSTOMER",
      "nodeType": "page",
      "title": "02 Business Central",
      "order": 2,
      "parentNodeId": "UABC-NAV-NODE-CUSTOMER",
      "documentId": "UABC-BCBDELIVERABLES",
      "initialState": "expanded"
    },
    {
      "nodeId": "UABC-NAV-NODE-BCBSTORY",
      "moduleId": "UABC-NAV-CUSTOMER",
      "nodeType": "page",
      "title": "03 Projekte",
      "order": 3,
      "parentNodeId": "UABC-NAV-NODE-CUSTOMER",
      "documentId": "UABC-BCBSTORY",
      "initialState": "expanded"
    },
    {
      "nodeId": "UABC-NAV-NODE-HYPERCARE",
      "moduleId": "UABC-NAV-CUSTOMER",
      "nodeType": "page",
      "title": "04 Handbuecher",
      "order": 4,
      "parentNodeId": "UABC-NAV-NODE-CUSTOMER",
      "documentId": "UABC-HYPERCARE",
      "initialState": "expanded"
    },
    {
      "nodeId": "UABC-NAV-NODE-ARCHIVE",
      "moduleId": "UABC-NAV-CUSTOMER",
      "nodeType": "page",
      "title": "99 Archiv",
      "order": 5,
      "parentNodeId": "UABC-NAV-NODE-CUSTOMER",
      "documentId": "UABC-ARCHIVE",
      "initialState": "expanded"
    },
    {
      "nodeId": "UABC-NAV-NODE-DECISIONS",
      "moduleId": "UABC-NAV-CUSTOMER",
      "nodeType": "page",
      "title": "02.1 Datenmigration",
      "order": 6,
      "parentNodeId": "UABC-NAV-NODE-BCBDELIVERABLES",
      "documentId": "UABC-DECISIONS",
      "initialState": "collapsed"
    },
    {
      "nodeId": "UABC-NAV-NODE-BCBDISCOVERY",
      "moduleId": "UABC-NAV-CUSTOMER",
      "nodeType": "page",
      "title": "02.2 Prozesse und Fit-to-Standard",
      "order": 7,
      "parentNodeId": "UABC-NAV-NODE-BCBDELIVERABLES",
      "documentId": "UABC-BCBDISCOVERY",
      "initialState": "collapsed"
    },
    {
      "nodeId": "UABC-NAV-NODE-BCBIMPLEMENTATION",
      "moduleId": "UABC-NAV-CUSTOMER",
      "nodeType": "page",
      "title": "02.3 Loesung und Einrichtung",
      "order": 8,
      "parentNodeId": "UABC-NAV-NODE-BCBDELIVERABLES",
      "documentId": "UABC-BCBIMPLEMENTATION",
      "initialState": "collapsed"
    },
    {
      "nodeId": "UABC-NAV-NODE-TESTS",
      "moduleId": "UABC-NAV-CUSTOMER",
      "nodeType": "page",
      "title": "03.1 Test und Abnahme",
      "order": 9,
      "parentNodeId": "UABC-NAV-NODE-BCBSTORY",
      "documentId": "UABC-TESTS",
      "initialState": "collapsed"
    },
    {
      "nodeId": "UABC-NAV-NODE-WALKTHROUGH",
      "moduleId": "UABC-NAV-CUSTOMER",
      "nodeType": "page",
      "title": "03.2 Cutover und Go-live",
      "order": 10,
      "parentNodeId": "UABC-NAV-NODE-BCBSTORY",
      "documentId": "UABC-WALKTHROUGH",
      "initialState": "collapsed"
    },
    {
      "nodeId": "UABC-NAV-NODE-BCBHCSTORY",
      "moduleId": "UABC-NAV-CUSTOMER",
      "nodeType": "page",
      "title": "03.3 Hypercare und Uebergabe",
      "order": 11,
      "parentNodeId": "UABC-NAV-NODE-BCBSTORY",
      "documentId": "UABC-BCBHCSTORY",
      "initialState": "collapsed"
    },
    {
      "nodeId": "UABC-NAV-NODE-BCBPROJECT",
      "moduleId": "UABC-NAV-PRODUCT",
      "nodeType": "page",
      "title": "00 BC Basic Produktuebersicht",
      "order": 0,
      "parentNodeId": "UABC-NAV-NODE-PRODUCT",
      "documentId": "UABC-BCBPROJECT",
      "initialState": "expanded"
    },
    {
      "nodeId": "UABC-NAV-NODE-PRODUCTAUDIENCE",
      "moduleId": "UABC-NAV-PRODUCT",
      "nodeType": "page",
      "title": "01 Zielgruppe und Einsatzfaelle",
      "order": 1,
      "parentNodeId": "UABC-NAV-NODE-PRODUCT",
      "documentId": "UABC-PRODUCTAUDIENCE",
      "initialState": "expanded"
    },
    {
      "nodeId": "UABC-NAV-NODE-PROCESSES",
      "moduleId": "UABC-NAV-PRODUCT",
      "nodeType": "page",
      "title": "02 Leistungsumfang und Abgrenzung",
      "order": 2,
      "parentNodeId": "UABC-NAV-NODE-PRODUCT",
      "documentId": "UABC-PROCESSES",
      "initialState": "expanded"
    },
    {
      "nodeId": "UABC-NAV-NODE-PRODUCTAPPROACH",
      "moduleId": "UABC-NAV-PRODUCT",
      "nodeType": "page",
      "title": "03 Phasen und Vorgehensmodell",
      "order": 3,
      "parentNodeId": "UABC-NAV-NODE-PRODUCT",
      "documentId": "UABC-PRODUCTAPPROACH",
      "initialState": "expanded"
    },
    {
      "nodeId": "UABC-NAV-NODE-TRAINING",
      "moduleId": "UABC-NAV-PRODUCT",
      "nodeType": "page",
      "title": "04 Lieferobjekte und Abnahme",
      "order": 4,
      "parentNodeId": "UABC-NAV-NODE-PRODUCT",
      "documentId": "UABC-TRAINING",
      "initialState": "expanded"
    },
    {
      "nodeId": "UABC-NAV-NODE-PRODUCTOFFER",
      "moduleId": "UABC-NAV-PRODUCT",
      "nodeType": "page",
      "title": "05 Angebot, Aufwand und Voraussetzungen",
      "order": 5,
      "parentNodeId": "UABC-NAV-NODE-PRODUCT",
      "documentId": "UABC-PRODUCTOFFER",
      "initialState": "expanded"
    },
    {
      "nodeId": "UABC-NAV-NODE-BCBHYPERCARE",
      "moduleId": "UABC-NAV-PRODUCT",
      "nodeType": "page",
      "title": "06 Optionen und Erweiterungen",
      "order": 6,
      "parentNodeId": "UABC-NAV-NODE-PRODUCT",
      "documentId": "UABC-BCBHYPERCARE",
      "initialState": "expanded"
    },
    {
      "nodeId": "UABC-NAV-NODE-PRODUCTSALESFAQ",
      "moduleId": "UABC-NAV-PRODUCT",
      "nodeType": "page",
      "title": "07 Vertriebsleitfaden und FAQ",
      "order": 7,
      "parentNodeId": "UABC-NAV-NODE-PRODUCT",
      "documentId": "UABC-PRODUCTSALESFAQ",
      "initialState": "expanded"
    },
    {
      "nodeId": "UABC-NAV-NODE-BLUEPRINT",
      "moduleId": "UABC-NAV-CONSULTANT",
      "nodeType": "page",
      "title": "00 Durchfuehrungsueberblick",
      "order": 0,
      "parentNodeId": "UABC-NAV-NODE-CONSULTANT",
      "documentId": "UABC-BLUEPRINT",
      "initialState": "expanded"
    },
    {
      "nodeId": "UABC-NAV-NODE-DISCOVERY",
      "moduleId": "UABC-NAV-CONSULTANT",
      "nodeType": "page",